reviewId,userName,userImage,content,score,thumbsUpCount,reviewCreatedVersion,at,replyContent,repliedAt,appVersion
c600a859-237c-487e-a94f-3d65a0788bd8,hina karim,https://play-lh.googleusercontent.com/a/ACg8ocLZL412V7XtEsmPkCjmyWasS7UNtR6YB4MIlfGS7QyrYRrmnQ=mo,fan,5,0,1.3.4,11/06/2026 15:06,,,1.3.4
9351c10e-0719-42cf-9d82-da5cbd1393dd,Free Time Ideas,https://play-lh.googleusercontent.com/a-/ALV-UjVFlkSkUH46_jXWQuFtyjlwAcE_EkpXBR5vTmhJuDt4vztxZfJz,I could not get otp code on the phone number and otp code on email was being delivered to me after the time was over it took me 7-8 tries and to get otp,2,0,1.3.4,10/06/2026 18:49,,,1.3.4
1f067eb2-c5c3-4c8d-ba60-68f2237e4f6d,malik usman,https://play-lh.googleusercontent.com/a-/ALV-UjU3Bl3RNY7MPDWT3H5uLOsfpfCUEpowl7XIZoCP1roUOJi7J58,today I tried cold drink first time. cloud noir its very very bad experience for me today. 70% ice cube and 30% drink. I paid 550rs for ice cube. what the hell is this.,1,0,1.3.4,07/06/2026 18:17,,,1.3.4
03ef3836-7257-4cc0-9fb2-827ed75900a6,Arsalan Qadeer,https://play-lh.googleusercontent.com/a/ACg8ocLOmAktI633md07mLDvs_4wowxxfD3W86uFWqk9k0aWZ1UPIA=mo,"That sounds incredibly frustrating and disorganized. Waiting 40 minutes only to receive cold or incorrect food ruins the experience, especially when it is clear the staff lacks management and skips the proper queue.",1,0,1.3.4,05/06/2026 20:53,,,1.3.4
84c9d31e-c134-4c45-82fb-6d73196df028,rabyia sultan,https://play-lh.googleusercontent.com/a/ACg8ocLt3cCgmZCvqBtmS7wgwUgn92B00dj6LON0kCtm1inhKKCHJw=mo,most ridiculous system of take away they force u to install app n make online payments while u r just standing outside of their branch n their app is so rubbish it took ages to put order n payment confirmation they r just forcing their customers to use app in order to build up their social marketing terrible behavior,1,0,1.3.4,05/06/2026 19:19,,,1.3.4
217eb0a1-1260-4528-b55d-817dd8fe4b09,Hadia tahir,https://play-lh.googleusercontent.com/a-/ALV-UjUxi677qIPkxJovxj6ysrIgxWYwElIWuq5qtWhTt9GFhrPqAQsuPw,worst app otp atta hi nai jb ata hey tou error ata otp add krney pr isko set kro bai😒😡😡😡,1,0,1.3.4,02/06/2026 16:51,,,1.3.4
93eac3b1-bf57-4445-855f-b916275284c6,SD RAHMAN,https://play-lh.googleusercontent.com/a/ACg8ocJnQ1iaDVBIEQCQkkGfOW_81kmSA5V0_dMvLwvyDUt2k2yGVQ=mo,nice,5,0,1.3.4,30/05/2026 13:55,,,1.3.4
f5489a44-88e3-4c88-a998-d9a784f7dda1,hammad nazir,https://play-lh.googleusercontent.com/a-/ALV-UjVNBnkM1BLwriWmjeJLf8k9QMo_E4Y_9p2XwE-L-pk_aVgJuzoN3A,stupid app .... design sucks,2,0,1.3.4,29/05/2026 19:57,,,1.3.4
c1bfddf5-eecd-49e1-8aca-c15825ca212f,Ume Habiba,https://play-lh.googleusercontent.com/a-/ALV-UjUxKm3QCYfTLGQKW5Rvjb1OeMMgqZP_Kbmr5_sPmO34jP9ZaHwO,too much slow processing of app,2,0,1.3.4,18/05/2026 15:37,,,1.3.4
7cabf2dc-13f2-4189-adba-333e530ae615,qais,https://play-lh.googleusercontent.com/a/ACg8ocI_P_6ZHxK_kV5xmXOf2vQDjE23mimthf3pEywFyLIlzJ8Mdg=mo,very testy,5,0,1.3.4,18/05/2026 11:35,,,1.3.4
a1c18b8e-e9ff-4dce-988a-ad8735660bb8,Muhammad Bilal,https://play-lh.googleusercontent.com/a-/ALV-UjVhVyl4t2kuFqM8bz6vvbIYM0l4QbjRw0vaAe_vQA9SQmW9swwOyQ,too difficult to order,2,0,1.3.4,11/05/2026 17:57,,,1.3.4
31cc4242-a4a6-4496-aa98-5b5e203786f0,Hiba Rehman,https://play-lh.googleusercontent.com/a/ACg8ocJlVvob0P_2CfqsEZ_9G0ctPWcmTbe6UOWMmHxq3BdMNrkmpxU=mo,"I am unable to place an order because I am facing an issue in your app. The location DHA 1 Sector B is not showing, while other sectors in DHA are available. Please fix this issue as soon as possible because I am unable to order.",3,0,1.3.4,11/05/2026 12:45,,,1.3.4
e71169e8-0b6e-497e-8db6-0b226f8f36d8,Syed Muhammad Hassan Maqsood,https://play-lh.googleusercontent.com/a/ACg8ocLNQkAx5BSVuJfzSPpuLIvyoIKaiLw2S3QNI5_zD44W2SG64Q=mo,Shop Ke Bahir Wait Krwa Ke Kehte Hain App Se Order Karain.,1,0,1.3.4,09/05/2026 18:23,,,1.3.4
5e69265f-59d4-4e23-8ee9-dac9951321c1,Awais Yousaf,https://play-lh.googleusercontent.com/a-/ALV-UjUImp7rf2iLMbG1sU2gT6DmlFO_LsY9QPMezteaPoD9zyTboxjj,1 Star till you don't add Gujranwala to the delivery location. 🙂,1,0,,08/05/2026 23:54,,,
c9ca561a-2145-418d-b49b-9a87579f00b6,Zarish Attique,https://play-lh.googleusercontent.com/a/ACg8ocKeW8D6tWjEv4i23dO45P6QONDSiEap3v4HBQezbtfZVhk2e9c=mo,good👍,5,0,1.3.2,07/05/2026 15:54,,,1.3.2
1f663128-4b7c-4c1c-8590-57351b53a48d,ali raza,https://play-lh.googleusercontent.com/a-/ALV-UjV7VQ8XTs-PC-ja0lK12WjTEnYETl9tXk39rZBaEWX4cVg7FspM,worst app ever. didn't open once,1,0,,05/05/2026 14:45,,,
8048f3d4-a940-426e-85d3-5a713697c1dd,Fried Skull,https://play-lh.googleusercontent.com/a/ACg8ocLJaRRIQl1nqAEPkvCxuu4bKSnrEczBqDpdz185m7z1MchhDw=mo,extremely sweet. horrendous taste. I literally feel the sweetness in my ears like ewww🤮🤮🤮🤮🤮🤮🤮🤮🤮🤮🤮🤮,2,1,,29/04/2026 7:27,,,
76cc7ffb-543a-4da6-a4bb-3a45319304e0,Haroon Khan,https://play-lh.googleusercontent.com/a/ACg8ocJTSc0OT-uM7yd9B30fe6bW81sH5CbsabrJtM7lAibR4W4rRA=mo,good and excellent,5,0,1.3.2,26/04/2026 16:25,,,1.3.2
3ea2187f-0eb9-43f0-b199-edf8e8c08877,Imran Nabi,https://play-lh.googleusercontent.com/a-/ALV-UjW5kgoFhJ899M9MDbzKgthAx0GlWfhNxnCWrxfUxS-AH8QRFDVJ,ok,5,0,1.3.2,19/04/2026 16:46,,,1.3.2
04b77995-66a9-41d5-8cb2-490823324147,Anjum Saeed,https://play-lh.googleusercontent.com/a-/ALV-UjWBIRLf7wDg_JmwXkZpgnKPZwUgW8FqwHItdv3cJjQ7s5MXU4FNFA,Downloaded but regretfully DHA Phase 7 Lahore is missing for delivery while almost entire Lahore is available۔ Isnt it strange,2,0,,19/04/2026 12:13,,,
bb61538b-096f-4514-add4-86eaacd73092,Brad Denefer,https://play-lh.googleusercontent.com/a-/ALV-UjVZdUvqC3MTULuPlWrReyCrE4uKyTAmB9p8fB_5N1GpnZeCYhA,the app has some bugs that need to be fixed and should be delivered in a wide range of the city but the cookies are awsome,3,0,1.3.2,18/04/2026 18:35,,,1.3.2
dfc535b7-61c7-4ece-8647-bd5682632cb6,Ever Green,https://play-lh.googleusercontent.com/a-/ALV-UjWF11qreg8Hd0d7suQuKB-5MyRZdQpMq8gR3Dp8NrFvNHGScCZlAQ,Very Slow Service,3,0,1.3.2,18/04/2026 17:59,,,1.3.2
60276b35-c855-40af-bb09-a4e5390ff6c0,danyal kailani,https://play-lh.googleusercontent.com/a/ACg8ocJwo1RlWLnE0arQCz3m9r8p5q3cHs90DEb25v6VOHLlx43OmQ=mo,too much complexities,1,1,1.3.2,18/04/2026 17:40,,,1.3.2
7c3c6af5-2d79-4d03-a536-9a80091d1b1d,Nauman Raheem,https://play-lh.googleusercontent.com/a-/ALV-UjXWn-OLWqUNm6pxlnrqJ4G_cn3zUhYMVEN1gheNAVjCA6gI7gL_,"I am new user but unfortunately can't avail 10% discount, unknown reason",2,0,1.3.2,15/04/2026 18:04,,,1.3.2
8c12dd0a-c244-47a1-81c7-5f35a0d98fee,aisha tahir,https://play-lh.googleusercontent.com/a/ACg8ocLKA8N8V7UqmAeO--mvy8e4Fex8Vea-p7Da9uUdP27OjaSJ_oc=mo,no discount applied,1,0,1.3.2,15/04/2026 16:12,,,1.3.2
63455782-96ed-4f0b-a491-d7a64c2ced55,Hafi Wajahat,https://play-lh.googleusercontent.com/a-/ALV-UjWNqlEE7eJCyr04S2pgsFx2Kde3f5dQhNIxv_mzM8iE8p5OGX4R,Mehmood Baddie Ka Fav 🤭,5,0,1.3.2,14/04/2026 16:33,,,1.3.2
71c0a59c-c35d-4f5c-835d-b22eebcea35a,Sarmad Khan,https://play-lh.googleusercontent.com/a/ACg8ocJMVnVirKUZC7qlBT15b-oh3MXTGClJh1fSTrDgGle6YXaUKA=mo,stuck.on registration. don't download this.,1,0,1.3.2,12/04/2026 10:00,,,1.3.2
93002ba7-39fa-4341-ab05-fabf015a5e01,Mianjaveed qamar,https://play-lh.googleusercontent.com/a-/ALV-UjXflSfoZuoZT1mfGeWfu_IuskOlW5FH0VfgR0IiJKqkDYXBGJ8,"This app doesn't have most of the locations, i tried searching for a location near my home but it didn't show up, please add more areas so that its easy to order",3,0,1.3.2,10/04/2026 16:21,,,1.3.2
d0db646a-db4b-4b49-a554-2ca8dac1737a,Abdullah Bin Khalid,https://play-lh.googleusercontent.com/a/ACg8ocLlecutmxsEYsIhGZrMGD0YRkFBF9P17QOnMP1BRgpOVE4UMQ=mo,it doesn't let me add a specific location.,4,0,1.3.2,10/04/2026 15:45,,,1.3.2
008ff64c-96cb-4298-aa88-9a7876e23a2b,muqadas raza,https://play-lh.googleusercontent.com/a-/ALV-UjWO3rFBT4QUK-TF2HEhzYIFiQr6cLuMKtHKCU4t4KtzHKNtI1Q,very slow service i have ever seen waiting for one cookie 🍪 for about 1 and a half hours is insane also didn't get off on the first order from their app,2,0,1.3.2,08/04/2026 19:35,,,1.3.2
42732a8c-cf96-4cce-92e2-2a8922ea3ce1,Tabish Riaz,https://play-lh.googleusercontent.com/a-/ALV-UjUAH0jm87-4bpHQ8_J9BogRTB3C0qJbGwsLQM8sQjT1JAFCeNBh,"payment by card flow is not working. breaks after approving payment. also I try to login with email, it gets errorrred out that number is in use, obviously it is because I am logging in.",1,0,1.3.2,08/04/2026 16:33,,,1.3.2
bdd59952-bd12-4c68-bdcd-7bc76a4163cc,Usaid Yaseen,https://play-lh.googleusercontent.com/a/ACg8ocJX0b_051CXzzIy2BjTuRLffDkTXE3aP-73nnaYawKjT9hXDg=mo,not all Lahore is covered in the app,1,0,1.3.2,06/04/2026 9:49,,,1.3.2
6b1f746d-f61b-419d-9d26-ecdde54f9504,Saba Noman,https://play-lh.googleusercontent.com/a-/ALV-UjWoEFT9CY2sTf2B7yxJ12U30qFYJ_mTejEQzM4UxPEjcWwZR6ctSA,app issues,3,0,1.3.2,05/04/2026 17:36,,,1.3.2
66c5be9c-7acf-4fea-ae2f-c54b3979a9dc,Ahmad Arshad Cheema,https://play-lh.googleusercontent.com/a-/ALV-UjXTJ4kWOpU06KAQftBcWkRydr1dWOTV2cOmok333lETiSGmoLHZhg,card payment not working,2,0,1.3.1,03/04/2026 14:08,,,1.3.1
23206f8e-3c89-4bc3-87c4-5d90e8334f71,majid hussain,https://play-lh.googleusercontent.com/a-/ALV-UjWG-oNkvfYT4ooFjECj25zgUbCKz_i8nnMtU49DgN4sWFdFf_P0,Muslim town option for delivery not available,1,0,,03/04/2026 10:24,,,
339e74af-8d76-4e2c-8c86-d1746fd01d98,Tayyab Naaz,https://play-lh.googleusercontent.com/a-/ALV-UjUc9ACx4Df0rNBxWNupW7uRcs7Mr0XPIXl9DJs8VtC6--TXDA,good,5,0,1.3.2,03/04/2026 10:18,,,1.3.2
cf65b5c2-2a3e-41d6-a7ad-4333be9cee0c,Muhammad ali Yousf,https://play-lh.googleusercontent.com/a/ACg8ocJ5kNo9qhRtWmfiCvx1kiaSOQg8bJkDRsG1YL4cVBm83ET-aw=mo,best in the terms or cravings 👌🏻💗,5,0,1.3.1,02/04/2026 17:31,,,1.3.1
7e0bfe1e-e37e-4921-8585-7da8a2b27b93,Eeshan khalid,https://play-lh.googleusercontent.com/a/ACg8ocK7BAZ1k_FwdS17jr_0E1tw9T_pLmVmgvhvrHgUdrHpXOZtLw=mo,bad website,2,0,1.3.1,02/04/2026 14:51,,,1.3.1
8b08505c-96f2-4c2b-85d1-89e843f106a9,Hadiyah,https://play-lh.googleusercontent.com/a/ACg8ocJQ4ZIRIRtnDK9WWGu2XCc0igxLLNb0gHXkOc5mf2WOhBIOjg=mo,bit expensive but worth it,5,0,1.3.1,01/04/2026 12:19,,,1.3.1
af2840ab-9ec4-4e17-a434-6ebaa9d14a54,Batool Naqvi,https://play-lh.googleusercontent.com/a-/ALV-UjWZqmOPBd8XSQOyOliMiRZnhsOxe_OvGyM3nhJUUuHlbFLTz5M,great,5,0,1.3.1,31/03/2026 16:45,,,1.3.1
c274be47-6a44-429b-9759-1aafe541cd88,Gulzaib Hassan,https://play-lh.googleusercontent.com/a/ACg8ocLSLE0z7IYmG_FVpFYqTUr79RfvPQ2qHDQ7-bSEpkUwsuT-ZA=mo,i love these cookies 🥰🥰😋😋💦💦🍑🍑,5,0,1.3.1,31/03/2026 10:48,,,1.3.1
c3965a69-46a6-4c71-a1cb-72e029b85030,Laraib Rabbani,https://play-lh.googleusercontent.com/a-/ALV-UjXIdipnMOznbdbeZxSWW3qbQEEEAkowU59NwWGcSzM2ITA3G0aK,"bad application, location picker doesn't work properly, promo codes don't work either. idk if they've hired noobs to make this app or what.",1,2,1.3.1,30/03/2026 14:59,,,1.3.1
e9f42bad-3b05-47b6-9d7a-1615be5b47cc,Mubeen Zafar,https://play-lh.googleusercontent.com/a-/ALV-UjX9LldNbRlvdKSr8oT3lBUKL_O29dyh7v4sx1cKF28nFaaB00In,"glitchy app, otp code ata he nai ha...",1,0,,28/03/2026 19:26,,,
bb43c92a-7314-4bc9-9355-43446978cef8,Fatima Ayyan,https://play-lh.googleusercontent.com/a/ACg8ocLXwl36ZaJXSHJ1WgJKOVCc05s_JJnCLgLBU8146adxVLSQZQ=mo,best please chichawatni 🙏,5,0,,28/03/2026 19:01,,,
972112a5-3910-49a3-b187-b564b40e4af5,Zayeem Kaleem,https://play-lh.googleusercontent.com/a-/ALV-UjVMq3rS-ZhHk0qie2B8nS7zG6fQKZiPjs0KOq1u5-o6jCsbxheE,very nice,5,0,1.3.1,28/03/2026 18:39,,,1.3.1
e7ca8e42-316e-44cc-aef8-cd7bb20ef6c3,Umer Toor,https://play-lh.googleusercontent.com/a-/ALV-UjV2NqNkxVbPWg1pDBUzsMDV3kFKdR8yeQyMvNIagbs6OkSn1Fc,delivery not available in most of the areas and the app is also glitchy.,1,1,1.3.1,28/03/2026 15:12,,,1.3.1
d8a4779f-bfc7-4807-ba35-652c00f4882d,Asim Raja,https://play-lh.googleusercontent.com/a/ACg8ocLRkoMWTf4OtAeUFJDShhKgaFMpZnpj0BcEYp8jOy9ZDbjB-zsR=mo,to much late delivery.,1,0,1.3.1,24/03/2026 20:08,,,1.3.1
62bd94aa-08c1-4917-a4bd-df431274d88d,Murtaza,https://play-lh.googleusercontent.com/a/ACg8ocIRdrscXlpiLlhsHDi556ye59_GaHKZp_abozKOJ5ONBJp7lg=mo,pathetic app I was a new user but didn't got discount saying I've already used it management also pathetic,1,0,,24/03/2026 14:23,,,
a412c441-71b4-403f-809c-41765f79e7f0,Fatima Khalid,https://play-lh.googleusercontent.com/a/ACg8ocIre8IHwUASS2ycAm63ISBG6kHa04oT36iVTuuXFLYFZfxkcg=mo,good 👍,5,0,1.3.1,24/03/2026 10:52,,,1.3.1
2fb874a5-dee3-4040-bb30-3d2d452b076f,Kinza Khalid,https://play-lh.googleusercontent.com/a/ACg8ocKMBH7F3tDTEapeEWAwTmyCkEptM-703lb4tGTPsBMrTD57Pw=mo,It was the best cookie I ever had,5,0,1.3.1,24/03/2026 10:17,,,1.3.1
f1ead812-c0e3-4308-854e-0f9b792ef867,Ch Noman Azhar,https://play-lh.googleusercontent.com/a-/ALV-UjUraqVoR5j-injjimQHJyWJjbs1fCWx7iwlQeaZ7pSDGJD2lDj6bw,best cookies in twin cities,5,0,1.3.1,23/03/2026 17:12,,,1.3.1
44def81b-99fe-418e-8087-d8aadb6a96a5,Parishay Aasif,https://play-lh.googleusercontent.com/a-/ALV-UjXex3wyX9rg8s9-L3AVRSKtpydAmBWHzbxzYJ6nsHBwJ3vlv28,love it!!!,5,0,1.3.1,23/03/2026 14:43,,,1.3.1
15f93bff-4d07-48ed-9b94-4b1814ab1235,Busy Bubbies,https://play-lh.googleusercontent.com/a-/ALV-UjWTFysle1LAYzIzdooPEHB8e5RqGJcvJukmHOcQJ_XIYgImvgvB,waited for almost 2 hour ...out for delivery order still not delivered.i ordered for the guests.worst service by bahria pase 4 branch.nobody even contacted to tell if they are delivering or not.,1,0,1.3.1,21/03/2026 21:38,,,1.3.1
0ca7adf9-8c5e-4df7-b4c1-7f7f28efe5dc,Rabia Kanwal,https://play-lh.googleusercontent.com/a/ACg8ocKlY_6fyZCIsn7KP__2Fq4GVacVTmw3VrAKb_9mOi4S2tNzHw=mo,"I love crumble cookies,their cookies and milkshakes everything is so good highly recommend ❤️",5,2,1.3.1,19/03/2026 17:26,,,1.3.1
b605fd47-569c-488f-9758-74774b90d74a,Muhammad Azeem Subhani,https://play-lh.googleusercontent.com/a-/ALV-UjW1iOXJxcL7LiBezKDE3i7ZHrf06UX2N92H9ncu6bEUEUZhM5CN,very poor service. placed an order and had to wait 1:30 minutes to get it. absolute worst service,1,1,1.3.1,18/03/2026 17:49,,,1.3.1
1eb4120c-b678-40f9-b1c8-f2ef087e53c4,Ubaidah Aamir,https://play-lh.googleusercontent.com/a/ACg8ocKSztnOkETEp-rZbXsU4xT8HFX_O52rSvQZCx7JAtIMRzqGMnE=mo,"The app is really simple and perfect to order but one thing about the app that should be fixed is the payment page. In my last order, the card payment couldn't be made as the human verification failed multiple times. Fix the issue please",4,5,1.3.1,16/03/2026 16:47,,,1.3.1
096d4891-aeec-4f5d-bd15-c47f73801be3,Shani Xhaikh,https://play-lh.googleusercontent.com/a-/ALV-UjUdL62vIgSP5cooHlfZcVngn2KkTGDpk_aVgdE3K6FfRNG1cdHl,very nice,5,0,1.3.1,16/03/2026 15:10,,,1.3.1
806fa168-06ce-44fe-a699-984d74f13b78,Tabinda Hammad,https://play-lh.googleusercontent.com/a-/ALV-UjVPu1XQAPeevrRP1XhEjOE502sOG11DotjWBTLcw-nriUMTswTxmg,great app love it,4,0,,14/03/2026 15:42,,,
48fd503f-9c58-4656-a690-a89d0f90a978,The National Standard,https://play-lh.googleusercontent.com/a-/ALV-UjXMys3la6A9rHQ08DSdX-ZvwMw0s3a9Z3OHU12t__9FKI3Hgdg6iw,wow,5,0,,13/03/2026 16:21,,,
c7cfe833-5a7d-4cb2-864d-a8068f51e01e,Saqib Awan,https://play-lh.googleusercontent.com/a-/ALV-UjVs4FUdL7f5hxBtEDLTiFiqunLhorcnxAnEgEJFMDXE2wbmB9c,worst application I tried many times to verify but couldn't succeed,1,0,1.3.1,13/03/2026 15:15,,,1.3.1
a476aa32-5ced-40fe-ae3d-807cea4b804d,Jamshaid Ahmad,https://play-lh.googleusercontent.com/a/ACg8ocK69m08iZq5Gqk0MvScFonTz9Cfuns8npQuNh0WPlrUsrNQHA=mo,there is option for card on delivery and it shows trouble shoot problem when it gets to add card info,3,0,1.3.1,12/03/2026 18:12,,,1.3.1
ba32c88e-d319-40ae-a283-18818bfa9366,رضوان راؤ,https://play-lh.googleusercontent.com/a-/ALV-UjWoFghduVaIuEOL6bxF3aIkNYgXPB473jvoKflivah9q4EPp5sPKg,"Really good experience with the Crumbl Cookies app—ordering was simple and smooth. The cookies from Crumbl Cookies I-8 Markaz were fresh and delicious, exactly as expected. The staff was very polite and cooperative, which made the whole experience even better. 👍🍪",5,6,1.3.1,11/03/2026 13:02,,,1.3.1
bbd536c5-60a7-4843-b011-ee893ba14337,Muhammad Sameer Amjad,https://play-lh.googleusercontent.com/a-/ALV-UjVUeNVq5q3pa5_RO3R30suxEt7K54W0FNQziH4IiJkpTS35y1v-,"loyality Points feature is glitchy. I didn't even utilised them a few times, just toggled to see the price change in the order and did not complete the order, only for me to find out that I no longer have those points",1,1,1.3.1,11/03/2026 11:03,,,1.3.1
822229ba-437a-4094-9c8f-a74fece5e504,Meerub Qureshi,https://play-lh.googleusercontent.com/a/ACg8ocKJ9XN4zK0G2SjHLFDzFU6aKe4lnhvfy54k3IVsBR44cwxWa5U=mo,"the app isn't working, it doesn't open.",2,0,1.3.1,11/03/2026 6:15,,,1.3.1
6a1f7e1b-cbfe-46cd-b0a0-e1f1007cc51a,Fahad Masood,https://play-lh.googleusercontent.com/a-/ALV-UjUssVa75C4GMDitnpRFNZXVwJmtAxQAMT5uIXjz-yMyevMluQiNRg,"app is telling me that I have already registered number for the same account/email, and not opening the account/email or letting me order. only app issue only.!! taste is good 👍🏻👍🏻👍🏻",3,0,1.3.1,09/03/2026 15:28,,,1.3.1
a76351a2-dfed-41cc-8a5b-24466b173112,Shaharyar Rao Khan,https://play-lh.googleusercontent.com/a-/ALV-UjVhhXl5klRgNfo8R28bw4-rxlqk-7NEg0sWaDRAKUlZWWsYT_EBXQ,please sign up thing . not instant method,5,0,1.3.1,08/03/2026 14:22,,,1.3.1
33d6dcae-a705-45cc-ab92-b7dd2593305d,Real Noob,https://play-lh.googleusercontent.com/a/ACg8ocKlw4aNqabZKaQHt25YvQxy2jSMXU3bewexbJdQqt6lVVT02Q=mo,ice-cream tastes amazing,5,0,1.3.1,07/03/2026 14:14,,,1.3.1
c18c466a-31d0-475c-a58d-b60387a9288f,Muhammad Haad,https://play-lh.googleusercontent.com/a-/ALV-UjVElF49o9zN875AE2SmBQPrfKlebf7J7goGWOKnpmEcZRYAWyY,It is hard to understand .It should support live order tracking,4,2,1.3.1,05/03/2026 14:13,,,1.3.1
a90bfa78-ba2f-460d-8902-d673cc3fa7dd,Omar Majid,https://play-lh.googleusercontent.com/a-/ALV-UjUR5vKp97KVyWB2GUL0W4GB7lQ-42SnjK-GJZjX0K_CsR5xB4c,wow egselent,5,0,1.3.1,05/03/2026 14:03,,,1.3.1
3d238dd8-ed32-46c9-8df9-e38f24bfc38d,hanan butt,https://play-lh.googleusercontent.com/a/ACg8ocLbFVfDCPTFs70sdw1sP9fjsRDRifTSJnB4l496Wq3qSWPDew=mo,good app,5,0,1.3.1,04/03/2026 13:40,,,1.3.1
b608f19c-a530-41ee-8f51-a779800b93ad,Mr Serious,https://play-lh.googleusercontent.com/a/ACg8ocJMb7oXVo0UdQJ015ml9NbCqAMMeU2xht6D7pejyuCwVn-FjVc=mo,Fake advertisement. It doesn't deliver everywhere.,1,1,,04/03/2026 10:32,,,
905980e7-8d21-49ad-acff-3d660e4a7f8e,Ubaid Khan,https://play-lh.googleusercontent.com/a/ACg8ocJUIHrY5rmq15jooTrSKqkt87ZSUGwHs6Oc9eK1mQW_KaPk_A=mo,very good 👍 osm,5,0,1.3.1,03/03/2026 15:27,,,1.3.1
666af26b-0f56-4c75-a91d-dd443ce43ec7,Mariyam Sarfraz,https://play-lh.googleusercontent.com/a-/ALV-UjWZdlju2oc-au16L9d2O61w4P4MUTKMb53ddNVLbocFXKQhQrE6,the app is glitchy and slow.,3,0,1.3.1,02/03/2026 11:36,,,1.3.1
bf33b257-9fda-4825-bac7-986bdc9e445c,Syeda Fatima,https://play-lh.googleusercontent.com/a/ACg8ocJ2toIX3cswW7BzNdeXQnF-098cgBsvjw_D-qzYYEMZYW0xJw=mo,overall your app is really helpful but you should add some more items like your newly launched cookies box,5,0,,02/03/2026 11:31,,,
71a43282-b666-4dfe-9f6c-8226bac1b2c5,Hamza Ali,https://play-lh.googleusercontent.com/a-/ALV-UjV7YUIXQ53kh0Yp2Q51NwgUlLtc69d5jpU3ThRTzXvjwHKRRBo,The app is very glitchy it keeps on crashing some buttons on the page dont work. If you add payment method as Card on Car Hop feature the app crashes.,1,0,1.3.1,28/02/2026 17:57,,,1.3.1
7a562a95-330b-4421-9e85-e931038a3dd2,Rabia Bibi,https://play-lh.googleusercontent.com/a/ACg8ocLPDXIPWPpVoaKIyY0jlBEDqFjRSY9ZzbE-v9pT4jRd_Fg_0Q=mo,"very good app, i always order from here",5,0,1.3.1,28/02/2026 16:48,,,1.3.1
7e47d768-31de-4b75-98a5-5dbad431ce04,Humaira Arif,https://play-lh.googleusercontent.com/a-/ALV-UjXy52UP4vnA12YVwrXNXww_uHMYiCdunhuJZWO5OAltGSKZk3jr,over priced and small size.,1,0,,28/02/2026 13:30,,,
92cc284a-ac31-4bae-9bab-2adae228d770,Mustaf Ch,https://play-lh.googleusercontent.com/a-/ALV-UjWHooILufZB0keJDiFp1aqeSlJLTQ7bEdllMFZT5fdxMyRSYogs9w,i love huzaifa bhai,5,0,1.3.1,28/02/2026 13:18,,,1.3.1
c6a155da-83fc-40dd-8e3e-a57f4fe457d3,Ali Ahmed,https://play-lh.googleusercontent.com/a-/ALV-UjWDjOJ9CSHokVzWjTxmnOrG2OvjF_uE7LCiMaaZXUB3LGflW03o,"I downloaded this app after seeing your ad about a promo code for new users. The offer looked great, so I installed the app and placed an order. But when I tried applying the promo code at checkout, it said the code was expired. That’s really disappointing. Advertising an offer that doesn’t work feels misleading. Not a good first experience. Please make sure your promotions are valid and updated.",1,3,1.3.1,28/02/2026 12:23,,,1.3.1
b31ba8c8-ca79-43a0-a896-2c9793b274bf,Muhammad Naoman Mohiuddin,https://play-lh.googleusercontent.com/a-/ALV-UjVDpSl3u28vdHYWuemT69nEmUfcnAWTVIt5cX-EKzAd8zCZmz67Ag,Good,5,0,1.3.1,27/02/2026 16:26,,,1.3.1
6b82b281-dde6-4b6d-98bb-578bb4e145be,Raja Muhammad Alisher,https://play-lh.googleusercontent.com/a-/ALV-UjWMilPB7qoEpm1uxG56-aIrou4Zu4Vbb4cAznbveW43Ny_7Ag8,verygood,5,0,1.3.1,27/02/2026 12:02,,,1.3.1
37d0748a-321b-4969-b869-2ef7b1dcea88,Husnain Tahir,https://play-lh.googleusercontent.com/a/ACg8ocIpsqaiITpDpzG-sexOuyke86pKYnMJUdNhXXIl1ypI2z4SKA=mo,good luck,5,0,,26/02/2026 8:17,,,
d12cd1c3-afe2-43a1-8193-9ee8c4254a2c,Hafsa Ajmal,https://play-lh.googleusercontent.com/a-/ALV-UjXIZbZ9wfXnSQIYYMTdFhkQGZJdXDfVfDZew6U47EOXGolGMlFn,great taste 😁😉,5,0,1.3.1,20/02/2026 17:50,,,1.3.1
9e00e9c8-157d-4c03-85a7-cbd681bf143e,Sadia Azhar,https://play-lh.googleusercontent.com/a/ACg8ocK-AaZ434dDHx8cbGNFecVui1awsdxxDzYPFtLQ8E0M7XZ-Eg=mo,very good,3,0,1.3.1,20/02/2026 15:08,,,1.3.1
12372892-30f2-489e-b18d-90f7a927158f,Aiza Habib,https://play-lh.googleusercontent.com/a-/ALV-UjXSNO14388xMNoDrJBXtQ1anmQkBwSDfL7NW_ldjBnGanPno6Lp,"I installed the app, it kept saying to update, i even install it again and still the app not working Also the app unable to detect my region area dont know wat to rate but yeah i havent even tried it yet",1,0,1.3.1,20/02/2026 11:49,,,1.3.1
2f30fe3f-281c-4d04-a05a-d512225d998b,Asaam Ali adnan,https://play-lh.googleusercontent.com/a/ACg8ocIAHeJ9Y4Luw85-F9zGhFzmzttzctTjt7s6D5dJp5rzvWIwqQ=mo,best,5,0,1.3.1,20/02/2026 11:08,,,1.3.1
66a06364-8b08-4533-9dda-26109585259c,Ather Mohiuddin,https://play-lh.googleusercontent.com/a-/ALV-UjUvXbw6-GKoQreYBJHUe8DMZ_fgkxUIDrNFTiKx5sAbObF4fXM,just downloaded it and it's asking for an update,1,0,1.3.1,20/02/2026 11:03,,,1.3.1
074a8fca-b9e5-468c-b275-cbb6c15cd0da,MR RKT,https://play-lh.googleusercontent.com/a-/ALV-UjUiTyGG6sVqnNm4CSu0Q2Z2rlpNNKeRZfh5IWmc5On-gY8il2KP,ٹیک آوے تو بالکل بھی اچھا نہیں کرمبلز کا آئس کریم کپ کے لئے کوئی بکس نہیں مہیا کیا جاتا۔۔کسٹمرز جنہوں نے نزدیک لے کر جانا ہوتا ہے مشکل پیش آتی ہے اور آگے گرمی کے موسم میں تو اور بھی مشکل ہوگی۔,1,0,1.3.1,20/02/2026 9:15,,,1.3.1
ff73f89a-a1f6-439e-b1c5-18c990de957a,Mujtaba Taj,https://play-lh.googleusercontent.com/a/ACg8ocIOO2OKg7_3-S1SyH889AeLvl4geqr6pOIy9_6rd-cfR9liwA=mo,I like it,5,0,1.3.1,20/02/2026 1:50,,,1.3.1
36418175-c39a-42a2-9b07-00a83e252b05,Hassan Shehraz,https://play-lh.googleusercontent.com/a/ACg8ocK8JybCD8yYp4mYY1bVL0yrTtBOcGcYyG8i0BRFtioKBIUqHw=mo,kindly add more location of Lahore.,5,0,1.2.9,18/02/2026 18:16,,,1.2.9
96459605-dc4e-49a8-ae52-ee68dcd6043d,Soda Milky,https://play-lh.googleusercontent.com/a/ACg8ocK2IXBtxk8v9Amd7DVs0LsKaiOVdOUYi7XaTkt4EleKD6H8gg=mo,Such a bad experience. It keep showing error . Worst app!!,1,0,1.2.9,12/02/2026 17:39,,,1.2.9
eb6d4d3d-2534-4d4c-84c6-f60d173b7958,Shaheen Noor,https://play-lh.googleusercontent.com/a/ACg8ocK2ZIu77penGCD35MCog_CfiF45fCMVmS8hR-1W_Oz3q7gPaw=mo,"There is so many flunctuation during ordering , i have tried to order from multiples phones but app is constantly showing error . It has wasted my time . Kindly fix the problem to aviod such issues",1,2,1.2.9,12/02/2026 17:00,,,1.2.9
0a4f1fb4-4cfa-43cc-8606-d23709f0c3a1,Faisal Bokhari,https://play-lh.googleusercontent.com/a-/ALV-UjWSaEQBUwzGwGeKotNg3Wt3nG-ZFU80t3Z_icc6CIIiTFZrQtRhpw,very bad miss cummunicat regarding promo discount didn't give discounts,1,0,1.2.9,11/02/2026 16:28,,,1.2.9
b245e2d9-07e0-437e-9942-28ffb896a4cd,Ahmad Hasan,https://play-lh.googleusercontent.com/a-/ALV-UjWaxY10YQovM63aVi83uT82i_ysha00Ei9fQbWPq994jjWgkoyj,Horrible app I cannot find my area on map and buggy as hell. I had around 188 points i tried to use them while placing an order the checkout screen bugged out. When i restarted the app they were all gone and the order wasnt placed.,1,7,1.2.9,09/02/2026 16:03,,,1.2.9
3764ade5-7928-475d-b7d1-2d1093d1886d,Akbar Lodhi,https://play-lh.googleusercontent.com/a/ACg8ocJGc8WeHYciUShFFvxImHmW6WrY3cU_3qn92Qm3viK3_qC5Cg=mo,best cookies in town,5,0,1.2.9,09/02/2026 11:15,,,1.2.9
190571a0-2217-47c4-a7e2-85bcdf405b53,sarah mohsin,https://play-lh.googleusercontent.com/a-/ALV-UjUXDgIqFBzwXGxvsE4uOoa-Y0uAykT1pU2Hc9G1TBllNnXrKB1i,Very delicious fresh cookies. Taste even better when paired with soft serve.,5,2,1.2.9,08/02/2026 14:28,,,1.2.9
57971072-f4ee-41e6-8b02-82b7d674a253,Wajahat Tayyab,https://play-lh.googleusercontent.com/a-/ALV-UjWzIl_xdhx4yLCHXbgqbQMasB0R4avV9r5gdfCVXQpe7LUV4DRt,It doesn't even deliver to my place and doesn't have it in the list.,1,0,1.2.9,07/02/2026 19:51,,,1.2.9
35b344bc-2765-414f-9fe7-eaf6d6afb2d4,RABBIYA AHSAN,https://play-lh.googleusercontent.com/a/ACg8ocJW4LwywKnhEJCim45sB0A_NWGrfKBiSQmYGiW3gm8BbqjzIw=mo,Yummiest,5,0,1.2.9,07/02/2026 19:49,,,1.2.9
00a2381d-1cb8-4f3c-ad5a-024146f4bc9c,Hifsa Kayani,https://play-lh.googleusercontent.com/a-/ALV-UjVMRiSQwHsbRfCoQSMNc7eUCqPrWt3HYbkrWfoASNrJARGetKH1,love it 😀 ♥️,5,0,1.2.9,04/02/2026 19:00,,,1.2.9
c683d698-1f00-4a9f-8514-4e13eee89e74,Fatima Junaid,https://play-lh.googleusercontent.com/a/ACg8ocIirBuBsJF25glRZZM2rau1KzNb7OlODuCZVLyDuWQJeeqd0A=mo,"Taste is really good, costly but work the experience👍🏻",5,0,1.2.9,03/02/2026 14:52,,,1.2.9
